id,created_at,text981788174161719296,2018-04-05 06:58:36,"b'@tony_john64 Hi,  we\xe2\x80\x99re sorry you feel this way and would like to resolve this. Could you please share details via\xe2\x80\xa6 https://t.co/wfcw3HJbPt'"
981786813898592257,2018-04-05 06:53:11,"b'@mdubey1985 Hi, we acknowledge the details and will get back to your shortly. Regards, Team Axis Bank'"
981784924469518336,2018-04-05 06:45:41,"b'@CRajiva @RBI @AxisBankSupport Hi, we re-iterate you to share your concerns on https://t.co/KCylEcNAhR . Our team w\xe2\x80\xa6 https://t.co/3HLvTpAFxs'"
981781387299704832,2018-04-05 06:31:38,"b'@kothuri0 Hi, we are here to help. Pls inbox us your registered contact details and we will get back to you at the\xe2\x80\xa6 https://t.co/enpYObBrNP'"
981772042210107392,2018-04-05 05:54:29,"b'@ArpitaPatkar @Sinha024Sinha @kirti00447 @AxisBankSupport Hi, thank you for reaching out. Please DM us your registe\xe2\x80\xa6 https://t.co/1Qr0OXBmNb'"
981765601571033088,2018-04-05 05:28:54,"b'@iamsmurugadoss @AxisBankSupport Hi, thank you for reaching out. Please DM us your registered number. We are here t\xe2\x80\xa6 https://t.co/FUtz1PEZO9'"
981752536469327872,2018-04-05 04:36:59,"b'@sunil_jn2002 Hi, The calls you receive are to inform you that you are eligible for enhancement in limit on your cr\xe2\x80\xa6 https://t.co/ih4dfZuBlg'"
981740520983719936,2018-04-05 03:49:14,"b'@abyjohn4Christ @AxisBankSupport Hi, we are here to help. Pls inbox us your specific issue and contact details and\xe2\x80\xa6 https://t.co/2PK3ab33wx'"
981551510227226624,2018-04-04 15:18:11,"b'@GargShreyansh21 @bandhanbank_in Hi, please elaborate the issue faced for us to look into the matter. Regards, Team Axis Bank.'"
981549800658173952,2018-04-04 15:11:23,"b'@samtron40bn Hi, please elaborate the issue faced for us to look into the matter. Regards, Team Axis Bank.'"
981548140590493697,2018-04-04 15:04:47,"b'@AshaNitinkumar Hi, please elaborate the issue faced for us to look into the matter. Regards, Team Axis Bank.'"
981538875163250688,2018-04-04 14:27:58,"b""@iPawanSharma_ Hi, give us a call on our phone banking number: 1860-419-5555/1860-500-5555. We'd be glad to assist\xe2\x80\xa6 https://t.co/EStxsg8y7Z"""
981538871417737221,2018-04-04 14:27:57,"b'@kumarnitish97 @AxisBankSupport Hi, Request you to elaborate your concern via DM along with your contact details to\xe2\x80\xa6 https://t.co/KQ4f9GJ2MU'"
981536119870369794,2018-04-04 14:17:01,"b'@ravindra658 Hi, thank you for reaching out. Please DM us your registered contact number. We are here to help! Regards, Team Axis Bank.'"
981535665681829888,2018-04-04 14:15:13,"b'@NITHINRAJB @AxisBankSupport Hi, we are here to help. Pls inbox us your specific issue and we will get back at the\xe2\x80\xa6 https://t.co/rRDDCiVhSI'"
981534620952027136,2018-04-04 14:11:04,"b'@raksha24760 Hi, thank you for reaching out. Please DM us your registered contact number. We are here to help! Regards, Team Axis Bank.'"
981531822998937601,2018-04-04 13:59:57,"b'@AligAfzal Hi, we have made a note of the feedback in this regard. Regards, Team Axis Bank'"
981509525051248640,2018-04-04 12:31:20,"b'@Shrawanspurohit @PURARAMCHOUDH19 @DHUKHARAMRAJPU2 Hi, we request you to share the exact location of Axis Bank ATM,\xe2\x80\xa6 https://t.co/0LyrfSrjVZ'"
981497180795166720,2018-04-04 11:42:17,"b'@asharma1195 @AxisBankSupport Hi, thank you for showing interest in opening an account with us. Request you to visi\xe2\x80\xa6 https://t.co/1mfD24KDNG'"
981490933513572352,2018-04-04 11:17:28,"b'@anuj_scorpion90 @AxisBankSupport Hi, Could you please elaborate your concerns via DM along with your contact detai\xe2\x80\xa6 https://t.co/FopoQtu60Z'"
981489755614601216,2018-04-04 11:12:47,"b'@IsaiRegd @FinMinIndia Hi, Could you please DM contact details to assist you further. Regards, Team Axis Bank.'"
981482724937609216,2018-04-04 10:44:51,"b'@Teesha_Nigam @AxisBankSupport Hi, we are here to help. Pls inbox us your registered contact details and we will ge\xe2\x80\xa6 https://t.co/DmHe0N0R2N'"
981482467268939776,2018-04-04 10:43:49,"b'@AligAfzal Hi, our branch timings are 9.30 am to 3.30 pm (Monday to Saturday).Please note, we are functional on fir\xe2\x80\xa6 https://t.co/YtrDWcwEGT'"
981482351682301953,2018-04-04 10:43:22,"b""@saurav_begu @AxisBankSupport Hi, give us a call on our phone banking number: 1860-419-5555/1860-500-5555. We'd be\xe2\x80\xa6 https://t.co/CfQm3bWhvA"""
981482115656232960,2018-04-04 10:42:26,"b'@Shaibal_Dey @AxisBankSupport Hi, we wish to inform that we are working on your concern vide service request number\xe2\x80\xa6 https://t.co/RsZaENt0Ga'"
981481891974012928,2018-04-04 10:41:32,"b""@tushar_sonawani Hi, give us a call on our phone banking number: 1860-419-5555/1860-500-5555. We'd be glad to assis\xe2\x80\xa6 https://t.co/g9pgotiqJv"""
981481573638983682,2018-04-04 10:40:16,"b'@BeingKapilBains Hi, request you to get in touch with your account holding bank and they will assist you further.So\xe2\x80\xa6 https://t.co/jlu88rILTt'"
981477864452362240,2018-04-04 10:25:32,"b'@narengp Hi, we request you to share exact location of the ATM along with ATM ID for us to assist you. Sorry for th\xe2\x80\xa6 https://t.co/kCM4dCajsN'"
981456696911564800,2018-04-04 09:01:25,"b'@manojkumar1214 Hi, we are here to help. Pls DM us your registered contact details and we will get back to you at t\xe2\x80\xa6 https://t.co/aLXXkiqeRB'"
981454798213050370,2018-04-04 08:53:53,"b""@Vikasgupta722 @AxisBankSupport Hi, give us a call on our phone banking number: 1860-419-5555/1860-500-5555. We'd b\xe2\x80\xa6 https://t.co/8AGhUU86Sv"""
981451576777863169,2018-04-04 08:41:05,"b'@rajeshasopa Hi, we\xe2\x80\x99re sorry you feel this way and would like to resolve this. Could you please share details via D\xe2\x80\xa6 https://t.co/NuR1IySPAe'"
981428413851426817,2018-04-04 07:09:02,"b'@aarunb88 @Airtel_Presence Hi, please share your contact details via DM to check.Sorry for the trouble.Regards Team Axis Bank.'"
981427498448715776,2018-04-04 07:05:24,"b'@MattooMudassar Hi, you can find information about the Axis ASAP account on this link: https://t.co/yBoEiA0wRv. Tha\xe2\x80\xa6 https://t.co/ZxGRvsfF58'"
981426895135952897,2018-04-04 07:03:00,"b'@ritamfb123 @AxisBankSupport Hi, we are sorry about the bad experience you had at our branch. Thanks for bringing t\xe2\x80\xa6 https://t.co/UBrAD6YAmh'"
981411191015858177,2018-04-04 06:00:36,"b'@Smedapati Hi, we have sensitized the respective Branch, in the referred matter. Sorry for the trouble. Regards, Team Axis Bank'"
981398629591277569,2018-04-04 05:10:41,"b'@savani4u Hi, you can select any branch and proceed with the opening of ASAP account. Regards, Team Axis Bank.'"
981392839224459265,2018-04-04 04:47:40,"b'@AmitSHA71982474 Hi, Please DM us your contact details and also elaborate your concern to assist you further. Regards, Team Axis Bank.'"
981391858667532288,2018-04-04 04:43:47,"b'@ranaec @AxisBankSupport @heenashah5692 Hi, as per our telephonic conversation we wish to inform you that we are wo\xe2\x80\xa6 https://t.co/prZ2w3FoXa'"
981389280743428096,2018-04-04 04:33:32,"b'@bikram_prasad @AxisBankSupport @ndtv @bsindia @RBI @FinMinIndia @ZeeBusiness Hi, thank you for reaching out. Pleas\xe2\x80\xa6 https://t.co/i1JKfYMkQZ'"
981371684539289601,2018-04-04 03:23:37,"b'@ranaec @AxisBankSupport Hi, we are here to help. Pls DM us your registered contact details and we will get back to\xe2\x80\xa6 https://t.co/d60gXdYnUK'"
981196728987803648,2018-04-03 15:48:24,"b'@KAMLESHDESAI9 Hi, we have tried contacting you today but unable to reach you. Request you to DM us the preferred t\xe2\x80\xa6 https://t.co/gHKDl3dpwA'"
981194237600464896,2018-04-03 15:38:30,"b'@falguniban @AxisBankSupport Hi, we are here to help. Pls DM us your specific issue and contact details and we will\xe2\x80\xa6 https://t.co/b3YmhhcrrC'"
981190244337963011,2018-04-03 15:22:38,"b'@SidrahDP @AxisBankSupport Hi, as per our brief telephonic conversation we understand that you are busy. We will ge\xe2\x80\xa6 https://t.co/pG9xrDC8od'"
981188797344907264,2018-04-03 15:16:53,"b""@resilient_sham @AxisBankSupport Hi, give us a call on our phone banking number: 1860-419-5555/1860-500-5555. We'd\xe2\x80\xa6 https://t.co/KuBfgjVF4d"""
981188337196204033,2018-04-03 15:15:03,"b'@aceanimesh Hi, request you to elaborate your concerns via DM for us to assist you. Regards, Team Axis Bank.'"
981184982159851521,2018-04-03 15:01:43,"b""@ae70f31fb8a1483 @AxisBankSupport Hi, give us a call on our phone banking number: 1860-419-5555/1860-500-5555. We'd\xe2\x80\xa6 https://t.co/BHC9XDFEfR"""
981184000638226434,2018-04-03 14:57:49,"b""@TiNA90331 @AxisBankSupport Hi, give us a call on our phone banking number: 1860-419-5555/1860-500-5555. We'd be gl\xe2\x80\xa6 https://t.co/roHFtJAhJd"""
981183724116238337,2018-04-03 14:56:43,"b""@iPawanSharma_ Hi, give us a call on our phone banking number: 1860-419-5555/1860-500-5555. We'd be glad to assist\xe2\x80\xa6 https://t.co/P3oM3X6qaS"""
981182737607376896,2018-04-03 14:52:48,"b'@Junaidk000 Hi, sorry for any trouble caused. Please elaborate your concerns via DM for us to look into the matter. Regards, Team Axis Bank.'"
981178767912529920,2018-04-03 14:37:02,"b'@hemajitphukon @AxisBankSupport Hi, please be informed that our phone banking numbers are chargeable. Regards, Team Axis Bank'"
981172879009054720,2018-04-03 14:13:38,"b'@VINODRA12251035 @AxisBankSupport Hi, we are here to help. Pls DM us your registered contact details and we will ge\xe2\x80\xa6 https://t.co/o4tfrWfTQL'"
981168841974665216,2018-04-03 13:57:35,"b'@savirama @AxisBankSupport @tv9kannada Hi, we request you to share exact location of the ATM along with ATM ID for\xe2\x80\xa6 https://t.co/EysKwPVKoG'"
981163597068840964,2018-04-03 13:36:45,"b'@Amit_A_Tiwari @HDFC_Bank @ICICIBank @RBI Hi, we request you to share ATM ID for us to look into the matter and ass\xe2\x80\xa6 https://t.co/pOcWBPMH5z'"
981159858048258048,2018-04-03 13:21:53,"b'@iampsagar Hi, to stop receiving promotional SMS, you may register your number for National Do Not Call Registry (N\xe2\x80\xa6 https://t.co/zRzCQRrE1u'"
981159178269020161,2018-04-03 13:19:11,"b'@prakash4555 Hi, we are here to help. Pls DM us your registered contact details and we will get back to you at the\xe2\x80\xa6 https://t.co/9MTeVa5IrS'"
981154001520603137,2018-04-03 12:58:37,"b'@iamshanu555 @AxisBankSupport Hi, we are here to help. Request you to DM us your registered contact details for us\xe2\x80\xa6 https://t.co/Xa6D6wzf3l'"
981153170524172288,2018-04-03 12:55:19,"b""@shashwat_gov Hi, give us a call on our phone banking number: 1860-419-5555/1860-500-5555. We'd be glad to assist y\xe2\x80\xa6 https://t.co/2EHUgnN7vl"""
981142980584198145,2018-04-03 12:14:49,"b""@anikmenon @AxisBankSupport Hi, give us a call on our phone banking number: 1860-419-5555/1860-500-5555. We'd be gl\xe2\x80\xa6 https://t.co/dEuUveexlf"""
981141104803401728,2018-04-03 12:07:22,"b'@ankeethanny007 @udemy Hi, we are here to help. Request you to DM us your registered contact details for us to assi\xe2\x80\xa6 https://t.co/BUHwcPaz4C'"
981137328302428161,2018-04-03 11:52:22,"b'@kumarnitish97 @AxisBankSupport Hi, Request you to elaborate your concern via DM along with your contact details to\xe2\x80\xa6 https://t.co/0tZROBaOxE'"
981137158017863681,2018-04-03 11:51:41,b'@chetan_mahi Hi. Thanks for showing an interest in Axis Bank. You can find about career opportunities with us on\xe2\x80\xa6 https://t.co/YfKxhH04ZD'
981133590896496641,2018-04-03 11:37:31,b'Stressing over acquiring multiple currencies for your holiday? Watch our film to learn how you can holiday without\xe2\x80\xa6 https://t.co/Wh5oK0dMdh'
981125444434001920,2018-04-03 11:05:09,"b'@TaarakSafetyEqp @FinMinIndia @arunjaitley @PMOIndia @AxisBankSupport Hi, Please DM us your registered contact deta\xe2\x80\xa6 https://t.co/wUCp1gSShw'"
981122592089235456,2018-04-03 10:53:48,"b'@adalquardz @rajivanand @arunjaitley @narendramodi Hi, we are here to help. Pls DM us your registered contact detai\xe2\x80\xa6 https://t.co/6xG4eZGhtS'"
981117394167980033,2018-04-03 10:33:09,"b'@CRajiva @AxisBankSupport Hi, request you to share your concerns on https://t.co/KCylEcNAhR . Our team will get bac\xe2\x80\xa6 https://t.co/S5NvHKP9PY'"
981115464242917376,2018-04-03 10:25:29,"b'@AuthorChetanD @AxisBankSupport @rajivanand Hi, Request you to please DM us the mobile number to assist you further\xe2\x80\xa6 https://t.co/KXfnB3uTYi'"
981108977365868544,2018-04-03 09:59:42,"b'@tushar_sonawani Hi, thanks for writing in. Request you to share with us your contact number via DM for us to assis\xe2\x80\xa6 https://t.co/DCukNfQSjc'"
981108851553505280,2018-04-03 09:59:12,"b'@kvsudip Hi, sorry for the trouble. Request you to share with us screenshot of the error for us to look in the conc\xe2\x80\xa6 https://t.co/TM9sv1aNR0'"
981108711979737088,2018-04-03 09:58:39,"b'@coolestlibrain @AxisBankSupport Hi, we wish to inform you that we are still working on your concern and will get b\xe2\x80\xa6 https://t.co/6vaiO1glzl'"
981105378833379330,2018-04-03 09:45:25,"b'@AKKI_MITTAL Hi, we are here to help. Pls DM us your registered contact details and we will get back to you at the\xe2\x80\xa6 https://t.co/0ekyFVc79r'"
981083341972701184,2018-04-03 08:17:51,"b'@PansariNeha Hi, please refer to the link: https://t.co/f3iDrHeQud to know the options to change your credit card P\xe2\x80\xa6 https://t.co/o9zO5jPjyP'"
981080331485892608,2018-04-03 08:05:53,"b'@parekhbhavin Hi, please contact our Phone Banking numbers 186041995555 / 18605005555 . We are here to assist! Regards, Team Axis Bank.'"
981077428595458049,2018-04-03 07:54:21,"b'@falguniban @AxisBankSupport Hi, please contact our Phone Banking numbers 186041995555 / 18605005555 . We are here\xe2\x80\xa6 https://t.co/2MinJa663b'"
981058568802701314,2018-04-03 06:39:24,"b'@ajavgal @hellodhani @DSiddananja @AxisBankSupport Hi, we are here to help. Pls DM us your specific issue and conta\xe2\x80\xa6 https://t.co/ugE3TkDSZp'"
981057585091575809,2018-04-03 06:35:30,"b'@sumanpaul027 Hi, Thanks for reaching out. Please elaborate your concern via DM to check. Sorry for the trouble. Regards, Team Axis Bank.'"
981056076006219777,2018-04-03 06:29:30,"b'@Oye_its_Abbas @AxisBankSupport Hi, we are here to help. Pls DM us your registered contact details and we will get\xe2\x80\xa6 https://t.co/SacIbUGUBV'"
981047654791688193,2018-04-03 05:56:02,"b'@KAMLESHDESAI9 Hi, we are here to help. Pls DM us your  contact details and we will get back at the earliest. Sorry\xe2\x80\xa6 https://t.co/v02bWWwV23'"
981045503449358336,2018-04-03 05:47:29,"b'@unusualrant Hi, our branches will be functional from April 3rd, 2018. Regards, Team Axis Bank'"
981039084431990784,2018-04-03 05:21:59,"b'@TarunKumarChand @wuodland @AxisBankSupport Hi, we are here to help. Pls inbox us your specific issue and contact d\xe2\x80\xa6 https://t.co/qVotTbeQ5M'"
981035118365233152,2018-04-03 05:06:13,"b'@apurvakedia Hi, we are sorry if you feel this way and would like to resolve this. Could you please elaborate your\xe2\x80\xa6 https://t.co/ATtugWbm6I'"
981034472018731008,2018-04-03 05:03:39,"b'@cadeeb Hi, we have taken up the case  with the relevant team and will get back to you within 48 working hours. Sorry for the trouble.'"
981034301767737345,2018-04-03 05:02:58,"b'@hellodhani @DSiddananja @ajavgal @AxisBankSupport Hi, give us a call on our phone banking number: 1860-419-5555/18\xe2\x80\xa6 https://t.co/Vqz61tC6rG'"
981033004981252097,2018-04-03 04:57:49,"b'@singhpalki Hi, we are sorry if you feel this way and would like to resolve this. Could you please elaborate your c\xe2\x80\xa6 https://t.co/7ZCBwigxoj'"
981030929413132289,2018-04-03 04:49:34,"b'@Slowbum @fayedsouza @indianbankers @AxisBankSupport Hi, Request you to please confirm the loan account number via\xe2\x80\xa6 https://t.co/G61GK0JARL'"
981024614414540801,2018-04-03 04:24:29,"b""@AuthorChetanD @AxisBankSupport Hi, give us a call on our phone banking number: 1860-419-5555/1860-500-5555. We'd b\xe2\x80\xa6 https://t.co/3ifWtRrG31"""
981023763545325573,2018-04-03 04:21:06,"b'@iAmViveksinh @AxisBankSupport Hi, Could you please DM your registered contact number along with the reference numb\xe2\x80\xa6 https://t.co/N3ldxhYjfv'"
981022351281344513,2018-04-03 04:15:29,"b'@santoshjkadam @AxisBankSupport Hi, we\xe2\x80\x99re sorry you feel this way and would like to resolve this. Could you please\xe2\x80\xa6 https://t.co/TvYLDHg1l8'"
981014151056289793,2018-04-03 03:42:54,"b'@SidrahDP @AxisBankSupport Hi, we request you to elaborate your concern and share with us your registered contact n\xe2\x80\xa6 https://t.co/XP2tIrarhC'"
981010973569028096,2018-04-03 03:30:17,"b'@SidrahDP @AxisBankSupport Hi, please be informed that the transactions are executed on bank working days. Please w\xe2\x80\xa6 https://t.co/r4zdkl89Gs'"
980810322729676802,2018-04-02 14:12:58,"b'@dsmsam2009 @HDFC_Bank @ICICIBank Hi, we are sorry for the inconvenience, pls DM us your\nspecific issue and contact\xe2\x80\xa6 https://t.co/2B09sWzafh'"
980800230621876224,2018-04-02 13:32:52,"b""@gocool2287 Hi, give us a call on our phone banking number: 1860-419-5555/1860-500-5555. We'd be glad to assist you\xe2\x80\xa6 https://t.co/UZubWu92cM"""
980793605806870530,2018-04-02 13:06:32,"b'@vasim_5472 @AxisBankSupport @narendramodi @RBI @arunjaitley Hi, we are here to help. Pls DM us your registered con\xe2\x80\xa6 https://t.co/slnqFQHGkT'"
980777091829510144,2018-04-02 12:00:55,"b'@discopiggu @chiragbarjatyaa Hi, Thank you for reaching out. Please elaborate on\nyour concern and DM your registere\xe2\x80\xa6 https://t.co/NOrmD8ow1K'"
980766914959028225,2018-04-02 11:20:28,"b'@shallu2876 Hi, Thank you for your interest. You can open the zero balance ASAP account and\navail the facility of v\xe2\x80\xa6 https://t.co/15MiGujrgr'"
980763514141802496,2018-04-02 11:06:58,"b'@joe_fran_cis @AxisBankSupport Hi, sorry for the trouble. Request you to DM us your\nregistered mobile number to ret\xe2\x80\xa6 https://t.co/uxXeTopZoX'"
980762892176936960,2018-04-02 11:04:29,"b'@priyorishi @AxisBankSupport Hi, we are working on your concern with reference number 39944030 and will get back to\xe2\x80\xa6 https://t.co/Y5W4mGmiQY'"
980759856931106816,2018-04-02 10:52:26,"b'@JigarPandyaa @AxisBankSupport Hi, Can you please DM us the screenshot of the error received along with your contac\xe2\x80\xa6 https://t.co/Q2OkYE8WX4'"
980727942408998913,2018-04-02 08:45:37,"b'@rishavkmr09 Hi, please elaborate on your issue for us to assist you further. Thanks for writing\nin. Regards Team Axis Bank.'"
980726751339872256,2018-04-02 08:40:53,"b'@dsahu040 @AxisBankSupport Hi, thank you for reaching out. Please DM us your registered contact number. We are here\xe2\x80\xa6 https://t.co/KaWxPQejsJ'"
980706234356596736,2018-04-02 07:19:21,"b'@gyagnesh @AxisBankSupport Hi, we will get in touch with you shortly. Sorry for the trouble.Regards, Team Axis bank.'"
980694674208894977,2018-04-02 06:33:25,"b'@rollingaurav @AxisBankSupport Hi, we regret the inconvenience caused to you in this regard. Please elaborate on yo\xe2\x80\xa6 https://t.co/yXYcbb99V5'"
980688033673555968,2018-04-02 06:07:02,"b'@pspratik @AxisBankSupport @TheOfficialSBI Hi, as per our record, our team is working on your concern vide referenc\xe2\x80\xa6 https://t.co/g5VRaXPJIU'"
980683908311379968,2018-04-02 05:50:38,"b'@rathorehemant @AxisBankSupport Hi, while we have made a note of your feedback regarding the electronic mode of pre\xe2\x80\xa6 https://t.co/O2Kez9gWKy'"
980681021397127168,2018-04-02 05:39:10,"b'@pspratik @AxisBankSupport @TheOfficialSBI Hi, we request the account holder to contact us directly on our Phone Ba\xe2\x80\xa6 https://t.co/pYSXqR5LCa'"
980679040800559105,2018-04-02 05:31:18,"b'@iamSateeshKumar Hi, You can place a request today through Internet Banking for fund transfer. Regards, Team Axis Bank'"
980676690979549189,2018-04-02 05:21:57,"b'@byshah09 @AxisBankSupport Hi, we are here to help. Pls DM us your registered contact details and we will get back\xe2\x80\xa6 https://t.co/9cew5bgDgc'"
980674760475594752,2018-04-02 05:14:17,"b'@ImSaifAkbar @AxisBankSupport Hi, Thank you for your interest. Please refer https://t.co/yBoEiA0wRv for information\xe2\x80\xa6 https://t.co/2FmF7Kf1ri'"
980662896811180032,2018-04-02 04:27:09,"b'@iamrisov Hi, we\xe2\x80\x99re sorry you feel this way and would like to resolve this. Could you please share your contact num\xe2\x80\xa6 https://t.co/czxu5lIqxz'"
980661968720850944,2018-04-02 04:23:27,"b'@gouravtweeting @AxisBankSupport Hi, thank you for your interest. Request you to refer\nthe following link :\xe2\x80\xa6 https://t.co/D32uYCVKRv'"
979988213073838080,2018-03-31 07:46:11,"b'@ImSaifAkbar @AxisBankSupport However, please treat this incident in isolation and continue to give us opportunity\xe2\x80\xa6 https://t.co/UNckplQrGN'"
979988062355804160,2018-03-31 07:45:36,"b""@ImSaifAkbar @AxisBankSupport Hi, as per today's telephonic conversation, we wish to inform you that the necessary\xe2\x80\xa6 https://t.co/jikZeonjda"""
979987514701369344,2018-03-31 07:43:25,"b'@ajoypanvel Hi, we would like to inform you that our chargeback has been rejected by the merchant acquiring bank st\xe2\x80\xa6 https://t.co/IA6JVcTQmB'"
979986936659050497,2018-03-31 07:41:07,"b'@sureshsa @AxisBankSupport @PMOIndia @RBI Hi, we are looking into your concern vide request number : 40169691 and w\xe2\x80\xa6 https://t.co/Hs8TUgAKwV'"
979961353971666944,2018-03-31 05:59:28,"b'@simha23 Hi, we are here to help. Pls DM us your specific issue and contact details and we will get back right away\xe2\x80\xa6 https://t.co/MJV0nAmQRK'"
979213983357067264,2018-03-29 04:29:41,"b'Bank holiday or not, #digitalbanking is always on! Axis Bank\xe2\x80\x99s internet banking, mobile banking &amp; ATM services are\xe2\x80\xa6 https://t.co/NKmHRthCu7'"
975988653070614528,2018-03-20 06:53:22,"b'Axis Bank launches a representative office in Sharjah, making it the 3rd rep office in the UAE. It was inaugurated\xe2\x80\xa6 https://t.co/crCbHAFN8b'"
975717190526750720,2018-03-19 12:54:40,"b'Looking for last minute tax saving? Invest in an ELSS online and save up to Rs. 46,350*. Register online, and find\xe2\x80\xa6 https://t.co/31tOb6ygcT'"
974677466080952320,2018-03-16 16:03:11,b'Know more: https://t.co/3lcZsUeLkB'
974677458115993600,2018-03-16 16:03:09,"b'No one deserves a holiday more than the people you love. And when your parents leave the hassle, worry and weight o\xe2\x80\xa6 https://t.co/qlXLX6dpX6'"
973926160982736896,2018-03-14 14:17:46,"b""RT @MahaDGIPR: .. @AxisBank  \xe0\xa4\xab\xe0\xa4\xbe\xe0\xa4\x8a\xe0\xa4\xa8\xe0\xa5\x8d\xe0\xa4\xa1\xe0\xa5\x87\xe0\xa4\xb6\xe0\xa4\xa8\xe0\xa4\x9a\xe0\xa5\x8d\xe0\xa4\xaf\xe0\xa4\xbe \xe0\xa4\xb5\xe0\xa4\xa4\xe0\xa5\x80\xe0\xa4\xa8\xe0\xa5\x87 '\xe0\xa4\xb6\xe0\xa4\xbe\xe0\xa4\xb6\xe0\xa5\x8d\xe0\xa4\xb5\xe0\xa4\xa4 \xe0\xa4\xb5\xe0\xa4\xbf\xe0\xa4\x95\xe0\xa4\xbe\xe0\xa4\xb8\xe0\xa4\xbe\xe0\xa4\xa4\xe0\xa5\x80\xe0\xa4\xb2 \xe0\xa4\xad\xe0\xa4\xbe\xe0\xa4\x97\xe0\xa5\x80\xe0\xa4\xa6\xe0\xa4\xbe\xe0\xa4\xb0\xe0\xa5\x80' \xe0\xa4\xaf\xe0\xa4\xbe \xe0\xa4\xb5\xe0\xa4\xbf\xe0\xa4\xb7\xe0\xa4\xaf\xe0\xa4\xbe\xe0\xa4\xb5\xe0\xa4\xb0\xe0\xa5\x80\xe0\xa4\xb2 \xe0\xa4\xa4\xe0\xa4\xbf\xe0\xa4\xb8\xe0\xa4\xb1\xe0\xa5\x8d\xe0\xa4\xaf\xe0\xa4\xbe \xe0\xa4\xb5\xe0\xa4\xbe\xe0\xa4\xb0\xe0\xa5\x8d\xe0\xa4\xb7\xe0\xa4\xbf\xe0\xa4\x95 \xe0\xa4\xaa\xe0\xa4\xb0\xe0\xa4\xbf\xe0\xa4\xb7\xe0\xa4\xa6\xe0\xa5\x87\xe0\xa4\x9a\xe0\xa5\x87 \xe0\xa4\xae\xe0\xa5\x81\xe0\xa4\x96\xe0\xa5\x8d\xe0\xa4\xaf\xe0\xa4\xae\xe0\xa4\x82\xe0\xa4\xa4\xe0\xa5\x8d\xe0\xa4\xb0\xe0\xa5\x80 @Dev_Fadnavi\xe2\x80\xa6"""
973926064752906240,2018-03-14 14:17:23,b'RT @MahaDGIPR: \xe0\xa4\xa6\xe0\xa5\x87\xe0\xa4\xb6\xe0\xa4\xbe\xe0\xa4\xa4 \xe0\xa4\xb8\xe0\xa4\xb0\xe0\xa5\x8d\xe0\xa4\xb5\xe0\xa4\xbe\xe0\xa4\xa7\xe0\xa4\xbf\xe0\xa4\x95 \xe0\xa4\xae\xe0\xa4\xbe\xe0\xa4\xa8\xe0\xa4\xb5 \xe0\xa4\xb5\xe0\xa4\xbf\xe0\xa4\x95\xe0\xa4\xbe\xe0\xa4\xb8 \xe0\xa4\xa8\xe0\xa4\xbf\xe0\xa4\xb0\xe0\xa5\x8d\xe0\xa4\xa6\xe0\xa5\x87\xe0\xa4\xb6\xe0\xa4\xbe\xe0\xa4\x82\xe0\xa4\x95 \xe0\xa4\x85\xe0\xa4\xb8\xe0\xa4\xb2\xe0\xa5\x87\xe0\xa4\xb2\xe0\xa5\x8d\xe0\xa4\xaf\xe0\xa4\xbe \xe0\xa4\xb6\xe0\xa4\xb9\xe0\xa4\xb0\xe0\xa4\xbe\xe0\xa4\x82\xe0\xa4\x9a\xe0\xa5\x8d\xe0\xa4\xaf\xe0\xa4\xbe \xe0\xa4\xb5\xe0\xa4\xbf\xe0\xa4\x95\xe0\xa4\xbe\xe0\xa4\xb8   \xe0\xa4\xa8\xe0\xa4\xbf\xe0\xa4\xb0\xe0\xa5\x8d\xe0\xa4\xa6\xe0\xa5\x87\xe0\xa4\xb6\xe0\xa4\xbe\xe0\xa4\x82\xe0\xa4\x95\xe0\xa4\xbe\xe0\xa4\xaa\xe0\xa4\xb0\xe0\xa5\x8d\xe0\xa4\xaf\xe0\xa4\x82\xe0\xa4\xa4 \xe0\xa4\xaf\xe0\xa4\xbe \xe0\xa5\xa7 \xe0\xa4\xb9\xe0\xa4\x9c\xe0\xa4\xbe\xe0\xa4\xb0 \xe0\xa4\x97\xe0\xa4\xbe\xe0\xa4\xb5\xe0\xa4\xbe\xe0\xa4\x82\xe0\xa4\x9a\xe0\xa4\xbe \xe0\xa4\xb5\xe0\xa4\xbf\xe0\xa4\x95\xe0\xa4\xbe\xe0\xa4\xb8 \xe0\xa4\x86\xe0\xa4\xa3\xe0\xa5\x82\xe0\xa4\xa8 \xe0\xa4\xaa\xe0\xa5\x8b\xe0\xa4\xb9\xe0\xa5\x8b\xe0\xa4\x9a\xe0\xa4\xb5\xe0\xa4\xa3\xe0\xa4\xbe\xe0\xa4\xb0- \xe0\xa4\xae\xe0\xa5\x81\xe2\x80\xa6'
973916566453653504,2018-03-14 13:39:38,"b'RT @ETNOWlive: .@ArunMaira Former Member of Planning Commission, Chairman of the Board of Trustees of HelpAge International says ""Enterpris\xe2\x80\xa6'"
973916503706865664,2018-03-14 13:39:23,b'RT @ETNOWlive: #Towards2Million - Watch Empowering A Million Livelihoods And The Journey Continues - LIVE Discussion from @AxisBank Foundat\xe2\x80\xa6'
973916212903149569,2018-03-14 13:38:14,b'Hon. Chief Minister of Maharashtra Shri. Devendra Fadnavis lit the ceremonial lamp to begin the Axis Bank Foundatio\xe2\x80\xa6 https://t.co/tAMRdYrRoU'
